,,Laura Janda,176,X ta seg i å V,,Hun kan ta seg i å savne sjølufta når hun besøker barndomsbygda.,,,,,,,,,,,,,,,,,,,,,,,,,,,,,,,,,,,,,,,,,,,,,,,,,,,,,,,,,,,,,,,,,,,,,,,,,,,,,,,,,,,,,
,,Laura Janda,177,Det aner X Cl,,Det aner meg hva faren min føler hver gang kystlandet slepper taket.,,,,,,,,,,,,,,,,,,,,,,,,,,,,,,,,,,,,,,,,,,,,,,,,,,,,,,,,,,,,,,,,,,,,,,,,,,,,,,,,,,,,,
,,Laura Janda,178,X få tak i/på Y,,Jeg skal få tak i ham og ordne opp i dette,,,,,,,,,,,,,,,,,,,,,,,,,,,,,,,,,,,,,,,,,,,,,,,,,,,,,,,,,,,,,,,,,,,,,,,,,,,,,,,,,,,,,
,,Laura Janda,179,X ordne opp i Y,,Jeg skal få tak i ham og ordne opp i dette,,,,,,,,,,,,,,,,,,,,,,,,,,,,,,,,,,,,,,,,,,,,,,,,,,,,,,,,,,,,,,,,,,,,,,,,,,,,,,,,,,,,,
,,Laura Janda,180,X sette Y på spill,,Han setter æren på spill,,,,,,,,,,,,,,,,,,,,,,,,,,,,,,,,,,,,,,,,,,,,,,,,,,,,,,,,,,,,,,,,,,,,,,,,,,,,,,,,,,,,,
,,Laura Janda,181,X komme (ikke) på tale,,Salg av Grønland kommer ikke på tale,,,,,,,,,,,,,,,,,,,,,,,,,,,,,,,,,,,,,,,,,,,,,,,,,,,,,,,,,,,,,,,,,,,,,,,,,,,,,,,,,,,,,
,,Laura Janda,182,X kaste seg inn/ut i Y,,Hun kaster seg inn i diskusjonen. Jeg kastet meg ut i dansen.,,,,,,,,,,,,,,,,,,,,,,,,,,,,,,,,,,,,,,,,,,,,,,,,,,,,,,,,,,,,,,,,,,,,,,,,,,,,,,,,,,,,,