,,,1748,VP туда-сюда,VP туда-сюда,Собака бегала туда-сюда.,,,,,,,,,,,Head + Modifier Construction,Adverbial Modifier,Adv,Pron; Adv,Spatial expression,Path:Goal,Manner,,,,,,,,NA,,,,,,,,,,,,,,,,,,,,,,,,,,,,,Unspecified,,,,,,,,,,,,,,,,,,,,Path: Goal,,,,,,,
,,,1749,NP/VP с хвоста/головы NP-Gen,NP/VP с хвоста/головы NP-Gen,Нумерация вагонов начинается с головы состава.,,,,,,,,,,,Head + Modifier Construction,Adverbial Modifier; Attributive,PP,Prep; Noun,Salient property,Unspecified,Spatial expression,Path:Source,,,,,,,NA,,,,,,,,,,,,,,,,,,,,,,,,,,,,,,,,,,,,,,,,,,,,,,Unspecified,,,Path: Source,,,,,,,
,,,1750,XP по полочкам,XP по полочкам,"Учитель разложил новую тему по полочкам, и стало всё понятно.",,,,,,,,,,,Head + Modifier Construction,Adverbial Modifier; Attributive,PP,Prep; Noun,Manner,,Temporary characteristics,Control,,,,,,,NA,,,,,,,,,,,,,,,,,,,,,,,,,,,,,Unspecified,,,,,,,,,,,,,,,,,,,,,,,,Control,,,
,,,1751,VP NP-Ins вперёд/назад,VP NP-Ins вперёд/назад,Мы съехали с горки головой вперёд.,,,,,,,,,,,Head + Modifier Construction,Adverbial Modifier,Adv,Adv,Manner,,,,,,,,,,NA,,,,,,,,,,,,,,,,,,,,,,,,,,,,,Unspecified,,,,,,,,,,,,,,,,,,,,,,,,,,,
,,,1752,VP на глазах,VP на глазах,Снег таял буквально на глазах.,,,,,,,,,,,Head + Modifier Construction,Adverbial Modifier,PP,Prep; Noun,Manner,,,,,,,,,,NA,,,,,,,,,,,,,,,,,,,,,,,,,,,,,Unspecified,,,,,,,,,,,,,,,,,,,,,,,,,,,
,,,1753,(так) что/чего (же/ж) PronPers-Nom раньше/сразу не VP-Pst?,(так) что/чего (же/ж) Pron-Nom раньше/сразу не VP-Past?,Тебе деньги нужны? Чего же ты раньше не сказал?,,,,,,,,,,,Clause,Clause,,,Reaction to the previous discourse,Surprise,Mirative,,,,,,,Interrogative,Colloquial,,,,,,,,,,,,,,,,,,,,,,,,,,,,,,,Unspecified,,,,,,,,,,Surprise,,,,,,,,,,,,,,,
,,,1754,"Cl, а PronPers-Nom как Verb-Pst?","Cl, а Pron-Nom как V-Past?","Она, конечно, в истерике, а ты как думал?!",,,,,,,,,,,Biclausal Construction,Biclausal,,,Reaction to the previous discourse,Surprise,Mirative,,,,,,,Interrogative / Exclamatory,Colloquial,,,,,,,,,,,,,,,,,,,,,,,,,,,,,,,Unspecified,,,,,,,,,,Surprise,,,,,,,,,,,,,,,
,,,1755,а вот это PronPers зря: (Cl),а вот это Pron зря: (Cl),Я разволновалась. –  А вот это зря. Плохой начальник – не повод для волнений.,,,,,,,,,,,Biclausal Construction,Biclausal,,,Reaction to the previous discourse,Disagreement,,,,,,,,Exclamatory,Colloquial,,,,,,,,,,,,,,,,,,,,,,,,,,,,,,,,,,,,,,,,,Disagreement,,,,,,,,,,,,,,,
,,,1756,(а) (вот) тут/здесь PronPers-Nom VP!,(а) (вот) тут/здесь Pron-Nom VP!,А вот тут ты ошибаешься! Предела нет и быть не может!,,,,,,,,,,,Clause,Clause,,,Reaction to the previous discourse,Disagreement,,,,,,,,Exclamatory,Colloquial,,,,,,,,,,,,,,,,,,,,,,,,,,,,,,,,,,,,,,,,,Disagreement,,,,,,,,,,,,,,,
,,,1757,да/ну я не Verb-Prs,да/ну я не V-Pres,"Вот собираюсь начать коллекционировать марки! – Ну, я не знаю, по-моему, это не самое увлекательное хобби.",,,,,,,,,,,Clause,Clause,,,Reaction to the previous discourse,Disagreement,,,,,,,,Assertive,Colloquial,,,,,,,,,,,,,,,,,,,,,,,,,,,,,,,,,,,,,,,,,Disagreement,,,,,,,,,,,,,,,
,,,1758,(ну/ну это) как Verb-Pfv.Inf,(ну/ну это) как V-Perf.Inf,"Да ведь такой вывод напрашивается здесь однозначно! – Ну, это как посмотреть. Я на это смотрю иначе.",,,,,,,,,,,Clause,Clause,,,Reaction to the previous discourse,Disagreement,,,,,,,,Exclamatory,Colloquial,,,,,,,,,,,,,,,,,,,,,,,,,,,,,,,,,,,,,,,,,Disagreement,,,,,,,,,,,,,,,
,,,1759,(да) как PronPers-Nom смеешь/смеете VP-Ipfv.Inf!,(да) как PronPers-Nom смеешь/смеете VP-Imp.Inf!,Как ты смеешь подозревать отца в нечестности!,,,,,,,,,,,Clause,Verb Pattern,,,Reaction to the previous discourse,Disagreement,,,,,,,,Exclamatory,Colloquial,,,,,,,,,,,,,,,,,,,,,,,,,,,,,,,,,,,,,,,,,Disagreement,,,,,,,,,,,,,,,
,,,1760,"дело не в том, что Cl (а в том, что Cl/просто Cl)","дело не в том, что Cl (а в том, что Cl/просто Cl)","Дело не в том, что меня не любили. Меня очень любили!",,,,,,,,,,,Connection Construction,Conjunction,,,Reaction to the previous discourse,Disagreement,,,,,,,,Assertive,Colloquial,,,,,,,,,,,,,,,,,,,,,,,,,,,,,,,,,,,,,,,,,Disagreement,,,,,,,,,,,,,,,
,,,1761,"дело не в том, Сl или Cl","дело не в том, Сl или Cl","Дело не в том, богатые мы или бедные. Дело не в том, во что я верю или не верю.",,,,,,,,,,,Connection Construction,Conjunction,,,Reaction to the previous discourse,Disagreement,,,,,,,,Assertive,Colloquial,,,,,,,,,,,,,,,,,,,,,,,,,,,,,,,,,,,,,,,,,Disagreement,,,,,,,,,,,,,,,
,,,1762,"что-то незаметно, что Cl","что-то незаметно, что Cl","Что-то незаметно, что ты торопишься.",,,,,,,,,,,Matrix + Subordinate Clause Construction,Matrix Predicate,,,Reaction to the previous discourse,Disagreement,,,,,,,,Assertive,Colloquial,,,,,,,,,,,,,,,,,,,,,,,,,,,,,,,,,,,,,,,,,Disagreement,,,,,,,,,,,,,,,
,,,1763,"не то чтобы Cl, (просто Cl)","не то чтобы Cl, (просто Cl)","Я не то чтобы не люблю рисовать, просто никогда этим не занимался.",,,,,,,,,,,Connection Construction,Conjunction,,,Reaction to the previous discourse,Disagreement,,,,,,,,Assertive,Colloquial,,,,,,,,,,,,,,,,,,,,,,,,,,,,,,,,,,,,,,,,,Disagreement,,,,,,,,,,,,,,,
,,,1764,"я бы не сказал, что Cl","я бы не сказал, что Cl","Я бы не сказал, что мне понравился этот рассказ.",,,,,,,,,,,Matrix + Subordinate Clause Construction,Matrix Predicate,VP,,Reaction to the previous discourse,Disagreement,,,,,,,,Assertive,Colloquial,,,,,,,,,,,,,,,,,,,,,,,,,,,,,,,,,,,,,,,,,Disagreement,,,,,,,,,,,,,,,
,,,1765,"PronPers-Dat легко/хорошо говорить, а я Cl","PronPers-Dat легко/хорошо говорить, а я Cl","Тебе легко говорить, а я пережила эту трагедию, как личную.",,,,,,,,,,,Biclausal Construction,,,,Reaction to the previous discourse,Disagreement,,,,,,,,Assertive,Colloquial,,,,,,,,,,,,,,,,,,,,,,,,,,,,,,,,,,,,,,,,,Disagreement,,,,,,,,,,,,,,,
,,,1766,я/мы не Verb-Prs и не Verb-Prs/Verb-Fut VP-Inf,я/мы не V-Pres и не V-Pres/V-Fut VP-Inf,Я не хочу и не буду об этом говорить.,,,,,,,,,,,Clause,Clause,,,Reaction to the previous discourse,Disagreement,,,,,,,,Assertive,Colloquial,,,,,,,,,,,,,,,,,,,,,,,,,,,,,,,,,,,,,,,,,Disagreement,,,,,,,,,,,,,,,
,,,1767,я/мы не Verb-Pst и не Verb-Pst VP-Inf,я/мы не V-Past и не V-Past VP-Inf,Я не хотел и не мог об этом писать.,,,,,,,,,,,Clause,Clause,,,Reaction to the previous discourse,Disagreement,,,,,,,,Assertive,Colloquial,,,,,,,,,,,,,,,,,,,,,,,,,,,,,,,,,,,,,,,,,Disagreement,,,,,,,,,,,,,,,
,,,1768,я/мы не хотеть-Pst и не хотеть-Prs,я/мы не хотеть-Past и не хотеть-Pres,Мы никого не хотели и не хотим обидеть.,,,,,,,,,,,Clause,Clause,,,Reaction to the previous discourse,Disagreement,,,,,,,,Assertive,Colloquial,,,,,,,,,,,,,,,,,,,,,,,,,,,,,,,,,,,,,,,,,Disagreement,,,,,,,,,,,,,,,
,,,1769,"какой смысл/в чём смысл/а смысл (NP-Dat) VP-Inf, (если Cl)?","какой смысл/в чём смысл/а смысл (NP-Dat) VP-Inf, (если Cl)?","Какой смысл менять то, что было всегда?",,,,,,,,,,,Clause,Clause,,,Reaction to the previous discourse,Disagreement,,,,,,,,Interrogative,Colloquial,,,,,,,,,,,,,,,,,,,,,,,,,,,,,,,,,,,,,,,,,Disagreement,,,,,,,,,,,,,,,
,,,1770,"ещё бы PronPers-Dat не Verb-Inf, Cl!","ещё бы Pron-Dat не V-Inf, Cl!","Ещё бы им не любить работу, когда они выросли в деревне!",,,,,,,,,,,Biclausal Construction,Clause,,,Reaction to the previous discourse,Evidence,,,,,,,,Exclamatory,Colloquial,,,,,,,,,,,,,,,,,,,,,,,,,,,,,,,,,,,,,,,,,Evidence,,,,,,,,,,,,,,,
,,,1771,"ещё бы PronPers-Nom не Verb-Pst, Cl!","ещё бы Pron-Nom не V-Past, Cl!","А он даст лодку? – Ещё бы он не дал, я же его любимчик!",,,,,,,,,,,"Discourse ""Echo"" Construction",Clause,,,Reaction to the previous discourse,Evidence,,,,,,,,Exclamatory,Colloquial,,,,,,,,,,,,,,,,,,,,,,,,,,,,,,,,,,,,,,,,,Evidence,,,,,,,,,,,,,,,
,,,1772,ещё бы – столько не Verb-Inf!,ещё бы – столько не V-Inf!,Как ты себя чувствуешь? – Плохо. – Ещё бы – столько не спать!,,,,,,,,,,,Cl/XP with parentheticals,Parenthetical,,,Reaction to the previous discourse,Evidence,,,,,,,,Exclamatory,Colloquial,,,,,,,,,,,,,,,,,,,,,,,,,,,,,,,,,,,,,,,,,Evidence,,,,,,,,,,,,,,,
,,,1773,навскидку NumCrd NP-Gen,навскидку NumCrd NP-Gen,Получилось навскидку тридцать страниц текста.,,,,,,,,,,,Head + Modifier Construction,Adverbial Modifier,Adv,Adv,Degree of accuracy,Approximate,Measure,,,,,,,,Colloquial,,,,,,,,,,,,,,,,,,,,,Approximate,,,,,,,,,Unspecified,,,,,,,,,,,,,,,,,,,,,,,,,,
,,,1774,VP навскидку,VP навскидку,"Я не готов сказать навскидку, надо уточнить.",,,,,,,,,,,Head + Modifier Construction,Adverbial Modifier,Adv,Adv,Degree of accuracy,Approximate,Manner,,,,,,,,Colloquial,,,,,,,,,,,,,,,,,,,,,Approximate,,,,,,,,Unspecified,,,,,,,,,,,,,,,,,,,,,,,,,,,
,,,1775,VP в/к NumCrd как штык,VP в/к NumCrd как штык,Чтобы к восьми утра был на работе как штык!,,,,,,,,,,,Head + Modifier Construction,Adverbial Modifier,Conj; Noun,Conj; Noun; Prep,Degree of accuracy,Exact,Manner,,,,,,,,Colloquial,,,,,,,,,,,,,,,,,,,,,Exact,,,,,,,,Unspecified,,,,,,,,,,,,,,,,,,,,,,,,,,,
,,,1776,VP NP-Nom в ~NP-Acc,VP NP-Nom в ~NP-Acc,"Я цитирую слово в слово, записывайте!",,,,,,,,,,,Head + Modifier Construction,Adverbial Modifier,Prep; Reduplication; Nominal pattern,Prep,Degree of accuracy,Exact,Manner,,,,,,,,NA,,,,,,,,,,,,,,,,,,,,,Exact,,,,,,,,Unspecified,,,,,,,,,,,,,,,,,,,,,,,,,,,
,,,1777,ни слова не VP,ни слова не VP,"Виталий уехал, не сказав жене ни слова.",,,,,,,,,,,Head + Modifier Construction,Adverbial Modifier,NP; Double Negation,Noun; Negation Marker,Non-existence,Unaffected small portion,Degree of intensity,Minimizer: Absence,,,,,,,NA,,,,,,,,,,,,,,,,,,,,,,Minimizer: Absence,,,,,,,,,,Unaffected small portion,,,,,,,,,,,,,,,,,,,,,,,,
,,,1778,XP – это PronPers-Dat Cop не XP,XP – это Pron-Dat Cop не XP,"Сибирь – это вам не Москва, здесь совсем другие условия.",,,,,,,,,,,Copula Construction,Praedicаtive Expression,Negation,Negation; Pron,Comparison,Contrast,Assessment,"Positive, Negative",Salient property,Characteristics through specification,,,,,Colloquial,,,,,,,,,,"Positive, Negative",,,,,,,Contrast,,,,,,,,,,,,,,,,,,,,,,,,,,,,,Characteristics through specification,,,,,,,,,,
,,,1779,VP в NP-Loc ,VP в NP-Loc ,Девушка была в страшном волнении.,,,,,,,,,,,Head + Modifier Construction,Adverbial Modifier,Prep,Prep,Temporary characteristics,Emotional state,,,,,,,,,NA,,,,,,,,,,,,,,,,,,,,,,,,,,,,,,,,,,,,,,,,,,,,,,,,,,,,,Emotional state,,,
,,,1780,"VP, и ну VP-Inf!","V, и ну VP-Inf!","Марина вышла на сцену, и ну танцевать!",,,,,,,,,,,Head + Modifier Construction,Adverbial Modifier,Conj; Particle,Conj; Particle,Phase of action,Inchoative,Mirative,,,,,,,,Colloquial,,,,,,,,,,,,,,,,,,,,,,,,,,,,,,,Unspecified,,,,Inchoative,,,,,,,,,,,,,,,,,,,,,
,,,1781,"Cl, нечего сказать!","Cl, нечего сказать!","Хорошенький у нас дом, нечего сказать!",,,,,,,,,,,Cl/XP with parentheticals,Parenthetical,VP; Negation,Verb; Pron,Assessment,Negative,,,,,,,,,Colloquial,,,,,,,,,,Negative,,,,,,,,,,,,,,,,,,,,,,,,,,,,,,,,,,,,,,,,,,,,,,
,,,1782,NP-Gen у NP-Gen не отнимешь/Cop не отнять,NP-Gen у NP-Gen не отнимешь/Cop не отнять,"Ну, правда, красивый я. Этого у меня не отнимешь.",,,,,,,,,,,Copula Construction,Praedicаtive Expression,VP; Negation,Negation Marker; Verb,Salient property,Property assignment,Assessment,Positive,,,,,,Assertive,NA,,,,,,,,,,Positive,,,,,,,,,,,,,,,,,,,,,,,,,,,,,,,,,,,,Property assignment,,,,,,,,,,
,,,1783,NP-Gen NP-Dat Cop не занимать,NP-Gen NP-Dat Cop не занимать,Хитрости ему не занимать.,,,,,,,,,,,Copula Construction,Praedicаtive Expression,VP; Negation,Negation Marker; Verb,Salient property,Property assignment,Assessment,"Positive, Negative",,,,,,,NA,,,,,,,,,,"Positive, Negative",,,,,,,,,,,,,,,,,,,,,,,,,,,,,,,,,,,,Property assignment,,,,,,,,,,
,,,1784,VP на радость NP-Dat,VP на радость NP-Dat,На радость детям выпал снег: можно лепить снеговиков.,,,,,,,,,,,Head + Modifier Construction,Adverbial Modifier,PP,Prep; Noun,Attitude,Emotional attitude,Purpose,,Addressee,Beneficiary,,,,,NA,,,,,,,,Beneficiary,,,Emotional attitude,,,,,,,,,,,,,,,,,,,,,,,,,,,,Unspecified,,,,,,,,,,,,,,,,,
,,,1785,VP на потеху NP-Dat ,VP на потеху NP-Dat ,Клоун выступает на потеху публике.,,,,,,,,,,,Head + Modifier Construction,Adverbial Modifier,PP,Prep; Noun,Addressee,Beneficiary,Purpose,,,,,,,,Obsolete,,,,,,,,Beneficiary,,,,,,,,,,,,,,,,,,,,,,,,,,,,,,,Unspecified,,,,,,,,,,,,,,,,,
,"Указание на адресата некоторого сообщения (собственно адресат) или действия (~ бенефициант: ""в угоду NP-Dat""; малефициант: ""назло NP-Dat"") - Получатель информации в ситуации речи. Включает бенефицианта и малефицианта.",,1786,VP в пику NP-Dat,VP в пику NP-Dat ,Открыли магазин здоровой еды в пику фастфуду.,C1,"Конструкция обозначает, что [участник]Participant демонстративно [совершает некоторое действие]Action из желания разозлить [другого участника]Maleficiary.",,,"[Хомский]Participant [говорил]Action в пику [Якобсону]Maleficiary, что от поэтики до лингвистики — как от французского садоводства до ботаники.","Правда, [М. М. Яншин]Participant, как первый исполнитель роли Лариосика, уже [поставил]Action в пику [МХАТу]Theme этот спектакль.","В 1938 году [Артуро Тосканини]Participant, демонстративно отказавшись от участия в организованных нацистами фестивалях, [основал]Action в пику [им]Maleficiary свой собственный.","Почти все были за него: [он]Participant резко [выступал]Action в пику [правительству]Theme, и этого казалось достаточно.","― [Я]Participant здесь скорее [говорю]Acction в пику [расхожему представлению]Theme, что либерализм ― это обязательно говорильня, критика и недовольство.","VP, NP, Dat",Head + Modifier Construction,Adverbial Modifier,PP,Prep; Noun,Addressee,Maleficiary,,,,,,,"Participant, Action, Maleficiary",,NA,"в, пика",NA,См. близкую конструкцию 1788 VP наперекор NP-Dat (Наперекор многим коллегам он верит в телепатию и путешествия во времени).,,,,,Maleficiary,,,,,,,,,,,,,,,,,,,,,,,,,,,,,,,,,,,,,,,,,,,,,,,,
,"Указание на адресата некоторого сообщения (собственно адресат) или действия (~ бенефициант: ""в угоду NP-Dat""; малефициант: ""назло NP-Dat"") - Получатель информации в ситуации речи. Включает бенефицианта и малефицианта.",,1787,VP наперекор NP-Dat ,VP наперекор NP-Dat ,Наперекор многим коллегам он верит в телепатию.,C1,"Конструкция обозначает, что [участник]Participant намеренно [совершает некоторое действие]Action. Это действие не соответствует действию, мнению или желанию [другого участника]Maleficiary или [некоторым правилам]Theme.",,,"[Я]Participant [буду гулять]Action ночами, наперекор всем [запретам]Theme.",[Идти]Action наперекор [общественному мнению]Theme способен далеко не каждый.,"Надо сказать, что при этом у меня совершенно не было намерений сознательно [поступать]Action наперекор [инструкциям]Theme директора, так сказать, «дразнить тигра».","[Идти]Action наперекор [своим влечениям]Theme в специальное учебное заведение, лишь из желания несколько лучшей карьеры, было бы большой ошибкой.","Но я очень боюсь, что мне придется [поступать]Action наперекор [себе]Maleficiary, своим ощущениям и принципам. ","VP, NP, Dat",Head + Modifier Construction,Adverbial Modifier,Prep,Prep,Addressee,Maleficiary,Concession ,Failed expectation,,,,,"Participant, Action, Maleficiary, Theme",,NA,наперекор,мнение,См. близкую конструкцию 1787 VP в пику NP-Dat (Открыли магазин здоровой еды в пику фастфуду).,,,,,Maleficiary,,,,,,,,,,,Failed expectation,,,,,,,,,,,,,,,,,,,,,,,,,,,,,,,,,,,,,
,"Указание на адресата некоторого сообщения (собственно адресат) или действия (~ бенефициант: ""в угоду NP-Dat""; малефициант: ""назло NP-Dat"") - Получатель информации в ситуации речи. Включает бенефицианта и малефицианта.",,1788,VP в укор NP-Dat,VP в укор NP-Dat ,"Газета напечатала рассказ не как пример для подражания, а в укор Хемингуэю.",C1,"Конструкция обозначает, что [участник]Participant осуждает [другого участника]Maleficiary за какое-либо действие (примеры 1, 2) и, как правило, также показывает свое критическое отношение, [делая словесное замечание]Action в разговоре (примеры 3, 4, 5) или совершая определенный поступок]Action (иллюстрация конструкции).",,,"[Церковная власть]Participant [ставит]Action в укор [католикам]Maleficiary, что они проповедуют в современной ситуации свободнее, чем то делали при православии.","[Известный физиолог Ферворн]Participant [ставит]Action в укор [Вейсману]Maleficiary то, что последний не принимает во внимание факта постоянного частичного разрушения внутри одноклеточных организмов.","Я терпеть не могу, когда [взрослые]Participant в укор [своим детям]Maleficiary [твердят]Action: «Пожил бы ты в детстве как я!».","В укор [командиру]Maleficiary [он]Participant [повторил]Action: «Слабовато», поджав в подтверждение губы.","― Нет, это [я]Participant тебе [говорю]Action не в укор, а потому, что пришлось к слову.","VP, NP, Dat",Head + Modifier Construction,Adverbial Modifier,PP,Prep; Noun,Addressee,Maleficiary,Purpose,,,,,,"Participant, Action, Maleficiary",,NA,"в, укор","ставить, поставить, говорить, сказать, быть",,,,,,Maleficiary,,,,,,,,,,,,,,,,,,,,,,,,,,,,,,,Unspecified,,,,,,,,,,,,,,,,,
,,,1789,NP касательно NP-Gen,NP касательно NP-Gen,Может подскажете кое-что касательно налогов?,,,,,,,,,,,Head + Modifier Construction,Attributive,Prep,Prep,Discourse structure,Topic,,,,,,,,,Formal,,,,,,,,,,,,,,,,,,,,,,,Topic,,,,,,,,,,,,,,,,,,,,,,,,,,,,,,,,,
,,,1790,уйма NP-Gen ,уйма NP-Gen ,"Не торопись, у нас ещё уйма времени.",,,,,,,,,,,Head + Modifier Construction,Nominal quantifier,Nominal Pattern,Noun,Measure,,Degree of intensity,Booster,,,,,,,Colloquial,,,,,,,,,,,,,,,,,,,,,,Booster,,,,,,,,Unspecified,,,,,,,,,,,,,,,,,,,,,,,,,,
,,,1791,дико XP,дико XP,"Она упрямая, но мне в ней это дико нравится.",,,,,,,,,,,Head + Modifier Construction,Adverbial Modifier,Adv,Adv,Degree of intensity,Maximizer,,,,,,,,,Colloquial,,,,,,,,,,,,,,,,,,,,,,Maximizer,,,,,,,,,,,,,,,,,,,,,,,,,,,,,,,,,,
,,,1792,абсолютно XP,абсолютно XP,Абсолютно согласен с Вами.,,,,,,,,,,,Head + Modifier Construction,Adverbial Modifier,Adv,Adv,Degree of intensity,Maximizer,,,,,,,,,NA,,,,,,,,,,,,,,,,,,,,,,Maximizer,,,,,,,,,,,,,,,,,,,,,,,,,,,,,,,,,,
,,,1793,совершенно XP,совершенно XP,Сейчас он выглядит совершенно иначе.,,,,,,,,,,,Head + Modifier Construction,Adverbial Modifier,Adv,Adv,Degree of intensity,Maximizer,,,,,,,,,NA,,,,,,,,,,,,,,,,,,,,,,Maximizer,,,,,,,,,,,,,,,,,,,,,,,,,,,,,,,,,,
,,,1794,стопроцентно XP,стопроцентно XP,Это стопроцентно коммерческое кино.,,,,,,,,,,,Head + Modifier Construction,Adverbial Modifier,Adv,Adv,Degree of intensity,Maximizer,,,,,,,,,Colloquial,,,,,,,,,,,,,,,,,,,,,,Maximizer,,,,,,,,,,,,,,,,,,,,,,,,,,,,,,,,,,
,,,1795,чуть ли не XP,чуть ли не XP,"Как можно закрыть фабрику, где работает чуть ли не десять тысяч человек?",,,,,,,,,,,Head + Modifier Construction,Adverbial Modifier,Adv; Negation,Adv; Negation Marker; Particle,Degree of intensity,Booster,,,,,,,,,Colloquial,,,,,,,,,,,,,,,,,,,,,,Booster,,,,,,,,,,,,,,,,,,,,,,,,,,,,,,,,,,
,,,1796,очень даже XP,очень даже XP,– Вода не имеет цвета. – Очень даже имеет! ,,,,,,,,,,,Head + Modifier Construction,Adverbial Modifier,Adv,Adv,Degree of intensity,Booster,,,,,,,,,Colloquial,,,,,,,,,,,,,,,,,,,,,,Booster,,,,,,,,,,,,,,,,,,,,,,,,,,,,,,,,,,
"About morphological markers of attenuativity cf. Makarova, Anastasia. 2014. Doctoral dissertation.",To be added,,1797,под-Verb,под-VP,"Я подзабыла, о чём мы говорили вчера.",B2,Конструкция выражает ослабленное или неполное [действие]Action.,,,"Через месяц, когда я уже, признаться, успел [подзабыть]Action о неудачном эксперименте, он вдруг позвонил мне.","― Отличная фотография, просто цвет [подправить]Action.","Любители сладкой овсянки могут [подсластить]Action уже готовую кашу, кроме сахара, изюмом, кусочками абрикосов или бананов.","Если люстра [поднадоела]Action, то подвесной потолок с точечными светильниками ― это как раз для вас.",,NA,Morphological Construction,Affix,Word-Formation,NA,Degree of intensity,Diminisher,Actionality,Attenuative,,,,,Action,,NA,под,"подзабыть, подсохнуть, поднадоесть",,To be added,Attenuative,,,,,,,,,,,,,,,,,Diminisher,,,,,,,,,,,,,,,,,,,,,,,,,,,,,,,,,,
