,,,1245,(NP-Dat) не следует VP-Inf,(NP-Dat) не следует VP-Inf,Не следует расслабляться при отсутствии полицейских на дороге.,,,,,,,,,,,Clause,Predicate,,,Prohibition,Attenuated prohibitive,,,,,,,,,NA,,,,,,,,,,,,,,,,,,,,,,,,,,,,,,,,,,,,,,Attenuated prohibitive,,,,,,,,,,,,,,,,,,
"См. также статью Рахилина, Е.В. Кондуктор, нажми на тормоза.. // Компьютерная лингвистика и интеллектуальные технологии: По материалам ежегодной Международной конференции «Диалог». Т. 1: Основная программа конференции. Вып. 12 (19). М.: РГГУ, 2013, 665-673. https://rakhilina.ru/files/rakhilinaev.pdf",Family of prohibitive constructions Strict causation to stop a strongly negative activity. 'Stop doing X'  imperatives,,1246,прекратить/перестать-Imper VP-Ipfv.Inf!,прекратить/перестать-Imper VP-Imp.Inf!,Прекрати капризничать!,B2,"Конструкция используется, когда говорящий побуждает собеседника больше не выполнять [некоторое действие]Action, которое происходит в данный момент. Часто глагол обозначает целую последовательность действий, а не единичное действие (пример 2). Говорящий оценивает это действие отрицательно, так как оно отрицательно по своей природе или неуместно в конкретной ситуации (пример 1). Конструкция представляет собой категорическое требование говорящего и подразумевает немедленное выполнение этого требования собеседником.","The construction is used when the speaker prompts the interlocutor to finish doing [some action]Action. An action is interpreted not as a single and continuous one, which must be stopped in the middle (cf .: *prekrati otkryvatʹ glaza ’stop opening your eyes'), but as a sequence of such actions that must be stopped. The speaker evaluates this action negatively; (s)he is also confident that this point of view is known to the addressee. The design is a categorical order of the speaker and implies the immediate fulfillment of this order by the interlocutor.",,"― Жука, дурка! Прекрати [реветь]Action, иначе не возьму… Захар задохнулся, подошел и прижал ее голову к груди.","И не было никого, кто бы сказал ей необходимые, хоть и бесполезные слова, которые говорятся в таких случаях: «Прекрати [себя изводить]Action… все равно не вернешь… надо жить дальше».",― Лера! ― строго прикрикнула на нее Надежда Михайловна.― Прекратите [потешаться над серьезными вещами]Action!,"― Козлы! ― сказала Ленка, когда мы вышли на улицу.―Перестань [ругаться]Action. Вдруг они стоят на балконе и всё слышат.","Перестаньте [драматизировать]Action, ситуации смешные на самом деле.","Imper, VP, Ipfv, Inf",Clause,Predicate,,,Prohibition,Continuative prohibitive,Causation,Direct,,,,,Action,Exclamatory,NA,"Прекрати, прекратите, перестань, перестаньте","Морочить голову, издеваться, ругаться, реветь, смеяться, потешаться","см. конструкции см. конструкции бросить-Imper VP-Imp.Inf (брось спорить), кончать-Imper VP-Imp.Inf (― Кончайте паниковать! ― строго сказал он нам с мамой.)",[root прекратить-Imper [xcomp VP-Imp.Inf]]; [root прекрати [xcomp капризничать]] ,,,,,,,,,,Direct,,,,,,,,,,,,,,,,,,,,,,,,Continuative prohibitive,,,,,,,,,,,,,,,,,,
"См. также статью Рахилина, Е.В. Кондуктор, нажми на тормоза.. // Компьютерная лингвистика и интеллектуальные технологии: По материалам ежегодной Международной конференции «Диалог». Т. 1: Основная программа конференции. Вып. 12 (19). М.: РГГУ, 2013, 665-673. https://rakhilina.ru/files/rakhilinaev.pdf","Family of prohibitive constructions Quantitative constructions 'enough of doing X' , milder tone",,1247,хорош VP-Ipfv.Inf!,хорош VP-Imp.Inf!,"Эй, наверху! Хорош прыгать!",C2,"Конструкция используется, когда говорящий побуждает собеседника прекратить выполнять [некоторое действие]Action. Говорящий оценивает это действие отрицательно, так как оно причиняет ему дискомфорт или кажется слишком длительным. Конструкция подразумевает отсутствие между говорящим и собеседником социальной иерархии и произносится в дружеском тоне.","The construction is used when the speaker prompts the interlocutor to stop performing [some action]Action. The speaker evaluates this action negatively, as it causes them discomfort or seems too long. The construction implies the absence of social hierarchy between the speaker and the interlocutor and is pronounced in a friendly tone.","Konstruksjonen brukes når taleren ønsker at samtalepartneren skal stoppe [handlingen]Action som foregår for tiden. Taleren evaluerer denne handlingen negativt, fordi den forårsaker ham ubehag eller tar for lang tid.","Я им говорю ― вы что, мужики. Хорош [слушать]Action этот концерт по радио!",― Хорош [ссориться]Action! ― прервал девушек Илья. ― Неконструктивно.,"― Эй, Артем! Хорош [спать]Action! Ну-ка вставай давай! Ты уже семь часов кряду дрыхнешь… Вставай же, соня!","― Хорош там [скакать]Action! ― крикнул Степан девочкам. Он сидел на корточках перед новой газовой плитой, читая руководство по эксплуатации.","― Васька, хорош [тормозить]Action! ― крикнул Андрей. ― Открывай скорее двери!","VP, Ipfv, Inf",Clause,Praedicаtive Expression,Praedic,Adj,Prohibition,Continuative prohibitive,Causation,Direct,,,,,Action,Exclamatory,Colloquial,хорош,"разговаривать, болтать, базарить, гнать, трепаться, орать, ругаться, ссориться, спать, дрыхнуть, прыгать, скакать","см. синонимичные конструкции хватит VP-Inf! (Хватит ругаться!), довольно VP-Inf! (довольно жаловаться). Не путать с конструкциями хороший-Short NP-Nom! (Хорош учёный!), NP-Nom хорош собой (Миша был удивительно хорош собой), NP хороший-Short/плохой-Short тем, что Adj/Cl (Чай хорош тем, что крепок), NP хороший-Short/плохой-Short NP-Ins (Эти места хороши своими лесами)",[root хорош [nsubj VP-Inf]]; [root хорош [nsubj прыгать]],,,,,,,,,,Direct,,,,,,,,,,,,,,,,,,,,,,,,Continuative prohibitive,,,,,,,,,,,,,,,,,,
"См. также статью Рахилина, Е.В. Кондуктор, нажми на тормоза.. // Компьютерная лингвистика и интеллектуальные технологии: По материалам ежегодной Международной конференции «Диалог». Т. 1: Основная программа конференции. Вып. 12 (19). М.: РГГУ, 2013, 665-673. https://rakhilina.ru/files/rakhilinaev.pdf","Family of prohibitive constructions Quantitative constructions 'enough of doing X' , milder tone that that of the standard prohibition",,1248,по́лно PronPers-2.Dat VP-Ipfv.Inf!,по́лно PronPers-2.Dat VP-Imp.Inf!,По́лно тебе плакать!,C2,"Конструкция используется, когда говорящий хочет, чтобы [собеседник]Participant прекратил выполнять [некоторое действие]Action, которое происходит в данный момент. Говорящий оценивает это действие отрицательно, так как оно причиняет ему дискомфорт или кажется слишком длительным. Как правило, речь идет о негативно оцениваемом поведении (врать, ссориться, спорить, примеры 1, 2) либо о негативном эмоциональном состоянии (грустить, горевать, обижаться, пример 3). В редких случаях речь идет о положительном или нейтральном действии, которое в данной ситуации интерпретируется как неуместное (пример 4). Конструкция произносится с дружеским тоном утешения или снисхождения к собеседнику. В ситуации утешения говорящий часто является старше по возрасту, чем собеседник (примеры 3). Побуждение может быть обращено к одному лицу или к группе лиц, которая не включает говорящего. В обоих случаях уместно слово ""по́лно"". Иногда вместо слова ""по́лно"" можно встретить уважительную форму ""по́лноте"" (пример 5), которая имеет еще более устаревший характер и может также использоваться при обращении как к одному лицу, так и к группе лиц.",,,"― Конечно, вы, товарищ лейтенант. И полно [вам]Participant [ругаться]Action. Ешьте суп, а то совсем холодный будет.","― Да полно [вам]Participant [ссориться]Action, девицы! ― Петь лучше давайте!","К удивлению матери, Иринка, хотя и извинилась за сломанную куклу и за то, что она была такою злою и скверною девочкой, тем не менее сама отказалась идти на именины к бабушке и объявила, что желает остаться дома. ― Ну ладно, ладно, уж полно [тебе]Participant [грустить-то]Action! ― уговаривала теперь девочку сама Дарья Михайловна. ― Мало что было да прошло, и поминать не следует, пойдем-ка лучше со мной к бабушке, она, наверное, ждет нас.","— Ну, полно [тебе]Participant [скромничать]Action, Яновский! — вступился Прокопович. — У него, господа, я знаю, есть тоже и стихи и проза, и очень недурные.","― Полноте [вам]Participant [трусить]Action, Антониночка, глядите, какое море нынче!.. С вышки террасы оно было видно как на ладони. Спокойный, тихий, голубовато-серый залив казался неподвижным, роскошным зеркалом. (1907)","PronPers, Dat, VP, Ipfv, Inf",Clause,clause,,,Prohibition,Continuative prohibitive,Causation,Direct,,,,,"Action, Participant",,Obsolete,"по́лно, полно, полноте","тебе, вам, врать, ссориться, зубоскалить, грустить, горевать, убиваться, оправдываться, скромничать","Частотными заполнителями являются глаголы, обозначающие поведение, оцениваемое отрицательно; глаголы, обозначающие действия, связанные с негативными эмоциями, жалобами, плохим настроением; глаголы, обозначающие неуместное бездействие. Ограничение на заполнение местоимения: тебе, вам, Вам. Синонимы: хватит, достаточно.",[root пoлно [obl Pron-2.Dat] [csubj VP-Inf]]; [root пoлно [obl тебе] [csubj плакать]],,,,,,,,,,Direct,,,,,,,,,,,,,,,,,,,,,,,,Continuative prohibitive,,,,,,,,,,,,,,,,,,
,A family of prohibitive constructions Delimitative,,1249,по-VP-Ipfv.Pst и хватит,по-VP-Imp.Past и хватит,Погуляли и хватит.,B2,"Конструкция выражает мягкий запрет на продолжение [действия]Action. Запрет может быть обращен к собеседнику, к самому говорящему или к группе лиц, которая может включать или не включать самого говорящего. Действие, которое нужно с точки зрения говорящего прекратить, продолжалось некоторое время. Это выражено глаголом с приставкой по-. Как правило, речь идет о развлечениях и веселом времяпрепровождении (гулять, шутить, играть, развлекаться, веселиться, шалить и др.), негативных эмоциональных переживаниях и их проявлениях (переживать, плакать) или действиях, связанных с речепроизводством (говорить, кричать, петь). В момент речи продолжение этого действия неуместно, поскольку нужно перейти к другому действию, более серьезному или спокойному. Говорящий одобряет прекращение действия и предлагает его закончить. Конструкция имеет разговорный характер и может звучать грубо по отношению к малознакомым людям.",,,"Может, тебе пора завести подружку? ― Ладно, [посмеялись]Action, и хватит. Работаем дальше…","Вот уж точно, эпоха аутентизма заканчивается: [побаловались]Action и хватит.","Вот такая трогательная история… Курочкин чуть не прослезился. Но [поболтали]Action ― и хватит. Надо было определиться, где искать концы в нашей истории…",― Я говорю. [Погулял]Action и хватит. Пора менять холостяцкие привычки.,"― Приказывай, повелитель, я нижайше повинуюсь! ― Все, Стас! ― посерьезнел Гуров. ― [Пошутили]Action, и хватит. Рассказывай, что удалось узнать.","VP, Ipfv, Pst",Clause,clause,,,Prohibition,Continuative prohibitive,Causation,Direct,,,,,Action,,Colloquial,"и, хватит","посмеялись, погуляли, пошутили, поиграли, порезвились, побаловался, поразвлекался, повеселиться, пошалили, подурачились, погостили, поговорили, покричали, попели, поболтали, попереживать, поплакать","Частотными заполнителями являются глаголы, обозначающие веселое, непринужденное времяпрепровождение, развлечения; глаголы речи; глаголы, обозначающие негативные эмоциональные переживания.",[root по-VP-Past [parataxis и [fixed хватит]]]; [root погуляли [parataxis и [fixed хватит]]],,,,,,,,,,Direct,,,,,,,,,,,,,,,,,,,,,,,,Continuative prohibitive,,,,,,,,,,,,,,,,,,
,,,1250,на основании NP-Gen Cl,на основании NP-Gen Cl,На основании статьи 3 закона об образовании каждый человек имеет право на образование.,,,,,,,,,,,Cl + Modifier Construction,Adverbial Modifier,PP,Prep; Noun,Cause,,,,,,,,,,Formal,,,,,,,,,,,,,,,Unspecified,,,,,,,,,,,,,,,,,,,,,,,,,,,,,,,,,,,,,,,,,
,,,1251,"Cl на основании того, что Cl","Cl на основании того, что Cl","Его уволили на основании того, что он не справлялся со своими обязанностями.",,,,,,,,,,,Connection Construction,Conjunction,Conj,,Cause,,,,,,,,,Assertive,Formal,,,,,,,,,,,,,,,Unspecified,,,,,,,,,,,,,,,,,,,,,,,,,,,,,,,,,,,,,,,,,
,,,1252,VP по NP-Dat,VP по NP-Dat,Он женился по любви.,,,,,,,,,,,Head + Modifier Construction,Adverbial Modifier,Prep,Prep,Cause,,,,,,,,,,Colloquial,,,,,,,,,,,,,,,Unspecified,,,,,,,,,,,,,,,,,,,,,,,,,,,,,,,,,,,,,,,,,
,,,1253,VP от NP-Gen,VP от NP-Gen,Ноги дрожат от страха.,,,,,,,,,,,Head + Modifier Construction,Adverbial Modifier,Prep,Prep,Cause,,,,,,,,,,NA,,,,,,,,,,,,,,,Unspecified,,,,,,,,,,,,,,,,,,,,,,,,,,,,,,,,,,,,,,,,,
,,,1254,"(NP-Dat) хватить NP-Gen, чтобы VP","(NP-Dat) хватить NP-Gen, чтобы VP","Хватило одного разговора, чтобы всё понять об этом человеке.",,,,,,,,,,,Biclausal Construction,Biclausal,Verb; Conj,,Cause,,Consequence,,,,,,,,NA,,,,,,,,,,,,,,,Unspecified,,,,,Unspecified,,,,,,,,,,,,,,,,,,,,,,,,,,,,,,,,,,,,
,,,1255,"вследствие того, что Cl, Cl","вследствие того, что Cl, Cl","Вследствие того, что произошло со мной за последние несколько часов, я вспомнила почти всё.",,,,,,,,,,,Connection Construction,Conjunction,Conj,,Cause,,,,,,,,,Assertive,Formal,,,,,,,,,,,,,,,Unspecified,,,,,,,,,,,,,,,,,,,,,,,,,,,,,,,,,,,,,,,,,
,,,1256,"фишка/соль Cop в том, что Cl","фишка/соль Cop в том, что Cl","Фишка в том, что мы уже были в этом месте.",,,,,,,,,,,Matrix + Subordinate Clause Construction,Matrix Predicate,Noun; Pron; Conj,,Cause,,,,,,,,,,Colloquial,,,,,,,,,,,,,,,Unspecified,,,,,,,,,,,,,,,,,,,,,,,,,,,,,,,,,,,,,,,,,
,,,1257,VP ввиду NP-Gen,VP ввиду NP-Gen,Он не пришёл ввиду болезни.,,,,,,,,,,,Head + Modifier Construction,Adverbial Modifier,Prep,Prep,Cause,,,,,,,,,,Formal,,,,,,,,,,,,,,,Unspecified,,,,,,,,,,,,,,,,,,,,,,,,,,,,,,,,,,,,,,,,,
,,,1258,VP по вине NP-Gen,VP по вине NP-Gen,По вине подрядчика работы не были выполнены в срок.,,,,,,,,,,,Head + Modifier Construction,Adverbial Modifier,PP,Prep; Noun,Cause,,,,,,,,,,NA,,,,,,,,,,,,,,,Unspecified,,,,,,,,,,,,,,,,,,,,,,,,,,,,,,,,,,,,,,,,,
,,,1259,"Cl из-за того, что Cl","Cl из-за того, что Cl","Я обиделся из-за того, что ты ничего мне об этом не сказала.",,,,,,,,,,,Connection Construction,Conjunction,Conj,,Cause,,,,,,,,,Assertive,NA,,,,,,,,,,,,,,,Unspecified,,,,,,,,,,,,,,,,,,,,,,,,,,,,,,,,,,,,,,,,,
,,,1260,"Cl по причине того, что Cl","Cl по причине того, что Cl","Мы не можем разместить в кабинете 50 человек по причине того, что он рассчитан всего на 30.",,,,,,,,,,,Connection Construction,Conjunction,Conj,,Cause,,,,,,,,,Assertive,Formal,,,,,,,,,,,,,,,Unspecified,,,,,,,,,,,,,,,,,,,,,,,,,,,,,,,,,,,,,,,,,
,,,1261,VP по причине NP-Gen,VP по причине NP-Gen,Ребёнок не пришел в школу по причине плохого самочувствия.,,,,,,,,,,,Head + Modifier Construction,Adverbial Modifier,PP,Prep; Noun,Cause,,,,,,,,,,Formal,,,,,,,,,,,,,,,Unspecified,,,,,,,,,,,,,,,,,,,,,,,,,,,,,,,,,,,,,,,,,
,"Указание на адресата некоторого сообщения (собственно адресат) или действия (~ бенефициант: ""в угоду NP-Dat""; малефициант: ""назло NP-Dat"") - Получатель информации в ситуации речи. Включает бенефицианта и малефицианта.",,1262,VP на потребу NP-Dat,VP на потребу NP-Dat,Они торгуют сувенирами на потребу туристам.,C2,"Конструкция обозначает, что [некоторое действие]Action осуществляется в интересах [группы участников]Beneficiary, в ответ на их нужды и запросы. Как правило, эти нужды и запросы оцениваются говорящим как примитивные, а конструкция в целом имеет негативный оттенок.",,,"Этот фильм ― типичный новодел, поверхностный и [сделанный]Action на потребу [невзыскательному зрителю]Beneficiary.","Все это стало результатом перехода от искусства к поточной культурной индустрии, [создающей стандартизированную продукцию]Action на потребу [капиталистическому рынку]Beneficiary.","Неизвестно, почему в этот интеллигентский круг вдруг пригласили певицу, [работающую]Action на потребу [толпе]Beneficiary.","Последняя газета, которую я регулярно читал, стремительно ""желтеет"": [публикует слезливые истории и дешевые сенсации]Action на потребу [обывателю]Beneficiary.","Это [профанация]Action на потребу [публике]Beneficiary, которой только дай поглумиться над кем-то, сославшись на авторитет.","NP, Dat, VP",Head + Modifier Construction,Adverbial Modifier,PP,Prep; Noun,Cause,,Addressee,Beneficiary,,,,,"Action, Beneficiary",,Obsolete,"на, потребу","толпа, публика, зрители, обыватели",,,,,,Beneficiary,,,,,,,Unspecified,,,,,,,,,,,,,,,,,,,,,,,,,,,,,,,,,,,,,,,,,
,,,1263,С какого (такого) перепуга Cl?,С какого (такого) перепуга Cl?,С какого перепуга я должен туда идти?,,,,,,,,,,,Cl + Modifier Construction,Adverbial Modifier,PP,Prep; Noun; PronInt,Cause,,,,,,,,,Interrogative / Exclamatory,Colloquial,,,,,,,,,,,,,,,Unspecified,,,,,,,,,,,,,,,,,,,,,,,,,,,,,,,,,,,,,,,,,
,,,1264,С какой (такой) радости Cl?,С какой (такой) радости Cl?,С какой радости ты меня провожаешь?,,,,,,,,,,,Cl + Modifier Construction,Adverbial Modifier,PP,Prep; Noun; PronInt,Cause,,,,,,,,,Interrogative / Exclamatory,Colloquial,,,,,,,,,,,,,,,Unspecified,,,,,,,,,,,,,,,,,,,,,,,,,,,,,,,,,,,,,,,,,
,,,1265,VP в отсутствие NP-Gen,VP в отсутствие NP-Gen,В отсутствие текилы они довольствовались водкой.,,,,,,,,,,,Head + Modifier Construction,Adverbial Modifier,PP,Prep; Noun,Temporary characteristics,Availability,Cause,,Non-Existence,Absence,,,,,NA,,,,,,,,,,,,,,,Unspecified,,,,,,,,,,,,,,,,,Absence,,,,,,,,,,,,,,,,,,,,,Availability,,,
