,,,537,NP-Nom Cop (NP-Nom) не из Adj-Gen.Pl,NP-Nom Cop (NP-Nom) не из Adj-Gen.Plur,Спа – это удовольствие не из дешёвых.,,,,,,,,,,,Copula Construction,Praedicаtive Expression,,,Subset,,Assessment,Negative,Salient property,Belonging to a class,,,,,NA,,,,,,,,,,Negative,,,,,,,,,,,,,,,,,,,,,,,,,,,,,,,,,,,,Belonging to a class,,,,Unspecified,,,,,,
,,,538,NP-Nom не иметь (Adj) значения,NP-Nom не иметь (Adj) значения,Деньги уже не имеют значения.,,,,,,,,,,,Predicate Argument Construction,Verb,,,Assessment,Negative,,,,,,,,Assertive,NA,,,,,,,,,,Negative,,,,,,,,,,,,,,,,,,,,,,,,,,,,,,,,,,,,,,,,,,,,,,
,,,539,NP-Nom не преминуть VP-Inf,NP-Nom не преминуть VP-Inf,Он не преминул сделать замечания.,,,,,,,,,,,Predicate Argument Construction,Verb,,,Result,subtype Result,,,,,,,,,Obsolete,,,,,,,,,,,,,,,,,,,,,,,,,,,,,,,,,,,,,,,,,,,Unspecified,,,,,,,,,,,,,
,,,540,ни в какую не VP,ни в какую не VP,Студент ни в какую не соглашается с преподавателем.,,,,,,,,,,,Head + Modifier Construction,Adverbial Modifier,PP; Double Negation,Prep; Pron; Negation Marker,Degree of intensity,Minimizer: Absence,,,,,,,,,Colloquial,,,,,,,,,,,,,,,,,,,,,,Minimizer: Absence,,,,,,,,,,,,,,,,,,,,,,,,,,,,,,,,,,
,,,541,NP-Nom Cop ни при чём,NP-Nom Cop ни при чём,Мы тут были ни при чём.,,,,,,,,,,,Copula Construction,Praedicаtive Expression,,,Cause,,,,,,,,,,Colloquial,,,,,,,,,,,,,,,Unspecified,,,,,,,,,,,,,,,,,,,,,,,,,,,,,,,,,,,,,,,,,
,,,542,NP-Nom обернуться NP-Ins,обернуться NP-Ins,Дело обернулось бедой.,,,,,,,,,,,Predicate Argument Construction,Verb,,,Result,subtype Result,,,,,,,,,NA,,,,,,,,,,,,,,,,,,,,,,,,,,,,,,,,,,,,,,,,,,,Unspecified,,,,,,,,,,,,,
,,,543,NP от NP-Gen,NP от NP-Gen,Ключ от двери,,,,,,,,,,,Head + Modifier Construction,Adj; Nominal pattern,Prep,,Salient property,Functionality,,,,,,,,,NA,,,,,,,,,,,,,,,,,,,,,,,,,,,,,,,,,,,,,,,,,,,,,,Functionality,,,,,,,,,,
,,,544,NP-Nom отличаться NP-Ins,NP-Nom отличаться NP-Ins,Он отличается большой выносливостью.,,,,,,,,,,,Predicate Argument Construction,Verb,,,Salient property,Property assignment,,,,,,,,,NA,,,,,,,,,,,,,,,,,,,,,,,,,,,,,,,,,,,,,,,,,,,,,,Property assignment,,,,,,,,,,
,,,545,NP-Nom относиться к числу NP-Gen,NP-Nom относиться к числу NP-Gen,Он относится к числу скептиков.,,,,,,,,,,,Predicate Argument Construction,Verb,,,Salient property,Belonging to a class,,,,,,,,,NA,,,,,,,,,,,,,,,,,,,,,,,,,,,,,,,,,,,,,,,,,,,,,,Belonging to a class,,,,,,,,,,
,,,546,VP за NP-Acc,VP за NP-Acc,Они боролись за мир на земле.,,,,,,,,,,,Head + Modifier Construction,Adverbial Modifier,Prep,Prep,Purpose,,,,,,,,,,NA,,,,,,,,,,,,,,,,,,,,,,,,,,,,,,,,,,,,,,,Unspecified,,,,,,,,,,,,,,,,,
,,,547,NP-Nom пере-Verb-ся NP-Ins,NP-Nom пере-V-ся NP-Ins,Они перекидываются шутками.,,,,,,,,,,,Predicate Argument Construction,Affix,Prefix; Suffix,,Manner,,,,,,,,,,NA,,,,,,,,,,,,,,,,,,,,,,,,,,,,,Unspecified,,,,,,,,,,,,,,,,,,,,,,,,,,,
,,,548,NP-Nom пребывать в NP-Loc,NP-Nom пребывать в NP-Loc,Он все это время пребывал в неведении.,,,,,,,,,,,Predicate Argument Construction,Verb,Verb,,Temporary characteristics,Sircumstances,,,,,,,,,NA,,,,,,,,,,,,,,,,,,,,,,,,,,,,,,,,,,,,,,,,,,,,,,,,,,,,,Sircumstances,,,
,,,549,NP-Nom пребывать на/в NP-Loc/у NP-Gen,NP-Nom пребывать на/в NP-Loc/у NP-Gen,Охранник пребывает на посту.,,,,,,,,,,,Predicate Argument Construction,Verb,,,Spatial expression,Location,,,,,,,,,Formal,,,,,,,,,,,,,,,,,,,,,,,,,,,,,,,,,,,,,,,,,,,,,,,,,Location,,,,,,,
,,,550,NP-Nom прийтись-Pst (NP-Dat) впору/в самый раз/как раз/в аккурат,NP-Nom прийтись-Past (NP-Dat) впору/в самый раз/как раз/в аккурат,Сапоги пришлись ему впору.,,,,,,,,,,,Predicate Argument Construction,Verb,,,Measure,Size,Degree of accuracy,Exact,,,,,,,NA,,,,,,,,,,,,,,,,,,,,,Exact,,,,,,,,,Size,,,,,,,,,,,,,,,,,,,,,,,,,,
,,,551,NP-Nom приходиться NP-Dat NP-Ins,NP-Nom приходиться NP-Dat NP-Ins,Этот мальчик приходится мне сыном.,,,,,,,,,,,Predicate Argument Construction,Verb,,,Salient property,Status,,,,,,,,,NA,,,,,,,,,,,,,,,,,,,,,,,,,,,,,,,,,,,,,,,,,,,,,,Status,,,,,,,,,,
,,,552,NP-Nom пройти/перешагнуть через NP-Acc,NP-Nom пройти/перешагнуть через NP-Acc,Дети прошли через всяческие испытания.,,,,,,,,,,,Predicate Argument Construction,Verb,,,Temporary characteristics,Sircumstances,Result,subtype Result,,,,,,,Colloquial,,,,,,,,,,,,,,,,,,,,,,,,,,,,,,,,,,,,,,,,,,,Unspecified,,,Unspecified,,,,,,,Sircumstances,,,
,,,553,прямо XP,прямо XP,Я прямо удивилась такой реакции.,,,,,,,,,,,Head + Modifier Construction,Adv,,,Degree of intensity,Maximizer,,,,,,,,,Colloquial,,,,,,,,,,,,,,,,,,,,,,Maximizer,,,,,,,,,,,,,,,,,,,,,,,,,,,,,,,,,,
,,,554,самый что ни на есть NP,самый что ни на есть NP,Ты самый что ни на есть умный человек!,,,,,,,,,,,Head + Modifier Construction,Adv,,,Assessment,Positive; Negative,Degree of intensity,Booster,,,,,,,NA,,,,,,,,,,"Positive, Negative",,,,,,,,,,,,Booster,,,,,,,,,,,,,,,,,,,,,,,,,,,,,,,,,,
,,,555,NP-Nom сделаться NP-Ins/Adj-Ins,NP-Nom сделаться NP-Ins/Adj-Ins,Он сделался важным начальником.,,,,,,,,,,,Predicate Argument Construction,Verb,,,Salient property,Status,,,,,,,,,Colloquial,,,,,,,,,,,,,,,,,,,,,,,,,,,,,,,,,,,,,,,,,,,,,,Status,,,,,,,,,,
,,,556,NP-Nom слыть NP-Ins,NP-Nom слыть NP-Ins,Она слыла отличницей.,,,,,,,,,,,Predicate Argument Construction,Verb,,,Salient property,Status,,,,,,,,,Obsolete,,,,,,,,,,,,,,,,,,,,,,,,,,,,,,,,,,,,,,,,,,,,,,Status,,,,,,,,,,
,,,557,"Cl, чтобы Cl","Cl, чтобы Cl","Я сообщил другу номер поезда, чтобы он меня встретил.",,,,,,,,,,,Connection Construction,Conjunction,Conj,,Purpose,,,,,,,,,,NA,,,,,,,,,,,,,,,,,,,,,,,,,,,,,,,,,,,,,,,Unspecified,,,,,,,,,,,,,,,,,
,,,558,VP/NP для NP-Gen,VP/NP для NP-Gen,Для удобства зрителей кресла заменили на новые.,,,,,,,,,,,Head + Modifier Construction,Verb pattern,,,Purpose,,,,,,,,,,NA,,,,,,,,,,,,,,,,,,,,,,,,,,,,,,,,,,,,,,,Unspecified,,,,,,,,,,,,,,,,,
,,,559,VP VP-Inf,VP VP-Inf,Он лег отдохнуть. Все сели смотреть телевизор.,,,,,,,,,,,Head + Modifier Construction,NA,NA,NA,Purpose,,,,,,,,,,NA,,,,,,,,,,,,,,,,,,,,,,,,,,,,,,,,,,,,,,,Unspecified,,,,,,,,,,,,,,,,,
,To be added,,560,так и VP-Ipfv,так и VP-Imp,Кот так и сидит на окне.,B2,"Конструкция выражает продолжительное [действие]Action, которое началось в прошлом. Ожидалось, что это действие должно было уже закончиться, но оно продолжается.",,,"Возможности технологий так и [остаются]Action до сих пор только потенциальными, их освоение идёт медленно.",Многие подростки так и [просидят]Action на диване или у компьютера всю молодость.,"А достоверные факты, увиденные глазами психолога, так и [остались]Action в научных архивах.",,,"VP, Ipfv",Head + Modifier Construction,Adverbial Modifier,Adv,Pron; Conj,Phase of action,Continuative,Degree of intensity,Maximizer,,,,,"Action, Participant",,NA,"так, и",,,[root [nsubj NP-Nom] [advmod так [fixed и]] VP]; [root [nsubj кот [advmod так [fixed и]] сидит],,,,,,,,,,,,,,,,,,Maximizer,,,,,,,,,,,,,Continuative,,,,,,,,,,,,,,,,,,,,,
,,,561,таки VP,NP-Nom таки VP,Он таки добился успеха несмотря на все сложности.,,,,,,,,,,,Head + Modifier Construction,Adverbial Modifier,Particle,Particle,Mirative,,,,,,,,,,Colloquial,,,,,,,,,,,,,,,,,,,,,,,,,,,,,,,Unspecified,,,,,,,,,,,,,,,,,,,,,,,,,
,,,562,NP-Nom терпеть не мочь NP-Acc/VP-Ipfv.Inf,NP-Nom терпеть не мочь NP-Acc/VP-Imp.Inf,Я терпеть не могу соревноваться!,,,,,,,,,,,Predicate Argument Construction,Verb,,,Attitude,Preferences: Negative,Assessment,Negative,,,,,,,Colloquial,,,,,,,,,,Negative,Preferences: Negative,,,,,,,,,,,,,,,,,,,,,,,,,,,,,,,,,,,,,,,,,,,,,
,,,563,NP-Nom того стоить,NP-Nom того стоить,Поездка в Африку того стоит.,,,,,,,,,,,Predicate Argument Construction,Verb,,,Assessment,Positive,,,,,,,,,Colloquial,,,,,,,,,,Positive,,,,,,,,,,,,,,,,,,,,,,,,,,,,,,,,,,,,,,,,,,,,,,
,,,564,"NP-Nom только и делать, что Cl","NP-Nom только и делать, что Cl","Он только и делает, что ходит в кино.",,,,,,,,,,,Matrix + Subordinate Clause Construction,Matrix Predicate,,,Pluractionality,Frequentative,Quantification,Exclusive,,,,,,Assertive,Colloquial,,,,,,,,,,,,,,,,,,,,,,,,,,Unspecified,,,,,,,,,,Frequentative,,,,,,,,,,,,,,,,,,,,
,,,565,NP-Nom умудриться/ухитриться VP-Inf,умудриться/ухитриться VP-Inf,Он умудрился упасть.,,,,,,,,,,,Predicate Argument Construction,Verb,,,Result,subtype Result,,,,,,,,,Colloquial,,,,,,,,,,,,,,,,,,,,,,,,,,,,,,,,,,,,,,,,,,,Unspecified,,,,,,,,,,,,,
,,,566,NP-Nom числиться на/в NP-Loc,NP-Nom числиться на/в NP-Loc,Он числился на службе.,,,,,,,,,,,Predicate Argument Construction,Verb,,,Salient property,Status,,,,,,,,,Formal,,,,,,,,,,,,,,,,,,,,,,,,,,,,,,,,,,,,,,,,,,,,,,Status,,,,,,,,,,
,,,567,NP-Nom числиться Adj-Ins/NP-Ins,NP-Nom числиться Adj-Ins/NP-Ins,Он числился отстающим в классе.,,,,,,,,,,,Predicate Argument Construction,Verb,,,Salient property,Status,,,,,,,,,Formal,,,,,,,,,,,,,,,,,,,,,,,,,,,,,,,,,,,,,,,,,,,,,,Status,,,,,,,,,,
,,,568,"NP что, VP/Cop Pred?","NP что, VP/Cop Praedic?","Он что, выпивает?",,,,,,,,,,,Clause,Clause,,,Discourse structure,Emphasis,Mirative,,,,,,,Interrogative / Exclamatory,Colloquial,,,,,,,,,,,,,,,,,,,,,,,Emphasis,,,,,,,,Unspecified,,,,,,,,,,,,,,,,,,,,,,,,,
,,,569,чуть (было) не VP-Pfv.Pst,чуть (было) не VP-Past.Perf,Он чуть было не забыл про экзамен.,,,,,,,,,,,Head + Modifier Construction,Adverbial Modifier,Adv; Negation,Adv; Negation Marker; Particle,Result,Antiresultative,,,,,,,,,Colloquial,,,,,,,,,,,,,,,,,,,,,,,,,,,,,,,,,,,,,,,,,,,Antiresultative,,,,,,,,,,,,,
,,,571,"NP-Nom Cop Adj-Cmp, чем NP-Nom/VP Adv-Cmp, чем NP-Nom","NP-Nom Cop Adj-Cmp, чем NP-Nom/VP Adv-Cmp, чем NP-Nom","Она старше, чем ты.",,,,,,,,,,,Copula Construction,Praedicаtive Expression,Conj,,Comparison,Inequality,,,,,,,,,NA,,,,,,,,,,,,,,,,,Inequality,,,,,,,,,,,,,,,,,,,,,,,,,,,,,,,,,,,,,,,
,,,572,NP-Nom Cop Adj-Nom до NP-Gen,NP-Nom Cop Adj-Nom до NP-Gen,Родители религиозные до фанатизма.,,,,,,,,,,,Copula Construction,Praedicаtive Expression,,,Degree of intensity,Booster,,,,,,,,,Colloquial,,,,,,,,,,,,,,,,,,,,,,Booster,,,,,,,,,,,,,,,,,,,,,,,,,,,,,,,,,,
,,,573,NP-Nom Cop NP-Dat к лицу,NP-Nom Cop NP-Dat к лицу,Синее платье было ей к лицу.,,,,,,,,,,,Copula Construction,Praedicаtive Expression,,,Assessment,Positive,,,,,,,,,Colloquial,,,,,,,,,,Positive,,,,,,,,,,,,,,,,,,,,,,,,,,,,,,,,,,,,,,,,,,,,,,
,,,574,NP-Nom NP-Dat Cop не NP-Nom,NP-Nom NP-Dat Cop не NP-Nom,Я вам не сын.,,,,,,,,,,,Copula Construction,Praedicаtive Expression,Negation,,Salient property,Status,,,,,,,,Exclamatory,Colloquial,,,,,,,,,,,,,,,,,,,,,,,,,,,,,,,,,,,,,,,,,,,,,,Status,,,,,,,,,,
,,,575,NP-Nom NP-Dat показать-Fut!,NP-Nom NP-Dat показать-Fut!,Я тебе покажу!,,,,,,,,,,,Clause,Clause,,,Threat,,,,,,,,,Exclamatory,Colloquial,,,,,,,,,,,,,,,,,,,,,,,,,,,,,,,,,,,,,,,,,,,,,,,,,,,,,,,Unspecified,
,,,576,NP-Nom ~NP-Dat рознь,NP-Nom NP-Dat рознь,Ученик ученику рознь.,,,,,,,,,,,Clause,Nominal pattern,Nominal pattern; Reduplication,,Comparison,Contrast,,,,,,,,,Colloquial,,,,,,,,,,,,,,,,,Contrast,,,,,,,,,,,,,,,,,,,,,,,,,,,,,,,,,,,,,,,
,,,577,NP-Nom Cop NP-Nom VP-Inf,NP-Nom Cop NP-Nom VP-Inf,Он мастер готовить.,,,,,,,,,,,Copula Construction,Praedicаtive Expression,NA,,Assessment,Positive,Salient property,Capacity for an activity,,,,,,,Colloquial,,,,,,,,,,Positive,,,,,,,,,,,,,,,,,,,,,,,,,,,,,,,,,,,,Capacity for an activity,,,,,,,,,,
,,,578,NP-Nom PronPers-Nom или кто?,NP-Nom PronPers-Nom или кто?,Помоги же! Человек ты или кто?,,,,,,,,,,,Clause,Clause,,,Salient property,Matching the standard,,,,,,,,Interrogative / Exclamatory,Colloquial,,,,,,,,,,,,,,,,,,,,,,,,,,,,,,,,,,,,,,,,,,,,,,Matching the standard,,,,,,,,,,
,,,579,NP-Nom Verb VP,NP-Nom V VP,Он идёт шатается.,,,,,,,,,,,Head + Modifier Construction,NA,NA,NA,Manner,,,,,,,,,,Colloquial,,,,,,,,,,,,,,,,,,,,,,,,,,,,,Unspecified,,,,,,,,,,,,,,,,,,,,,,,,,,,
,,,580,(а) NP-Nom (как/вдруг) Verb-Bare (PP/Adv),(а) NP-Nom (как/вдруг) Verb-Bare (PP/Adv),Ребенок вдруг хлоп об землю!,,,,,,,,,,,Clause,Clause,Adv; Conj,,Mirative,,Manner,,,,,,,Exclamatory,NA,,,,,,,,,,,,,,,,,,,,,,,,,,,,,Unspecified,,Unspecified,,,,,,,,,,,,,,,,,,,,,,,,,
,,,581,Cl в то время как Cl,Cl в то время как Cl,Она пришла в то время как он уходил.,,,,,,,,,,,Matrix + Subordinate Clause Construction,Matrix Predicate,,,Taxis,Simultaneous action,,,,,,,,Assertive,NA,,,,,,,,,,,,,,,,,,,,,,,,,,,,,,,,,,,,,,,,,,,,,,,,,,,Simultaneous action,,,,,
,,,582,VP за NP-Ins,VP за NP-Ins,Он молчал за обедом.,,,,,,,,,,,Head + Modifier Construction,Adverbial Modifier,Prep,Prep,Time,Time period,,,,,,,,,NA,,,,,,,,,,,,,,,,,,,,,,,,,,,,,,,,,,,,,,,,,,,,,,,,,,,,Time period,,,,
,,,583,VP изо всех сил,VP изо всех сил,Ваня бежал изо всех сил.,,,,,,,,,,,Head + Modifier Construction,Adverbial Modifier,PP,Prep; Noun; Pron,Manner,,Degree of intensity,Maximizer,,,,,,,NA,,,,,,,,,,,,,,,,,,,,,,Maximizer,,,,,,,Unspecified,,,,,,,,,,,,,,,,,,,,,,,,,,,
,,,584,VP как (Prep) NP,VP как (Prep) NP,Я мог к нему прийти как ученик.,,,,,,,,,,,Head + Modifier Construction,Conj,Conj,,Salient property,Status,,,,,,,,,NA,,,,,,,,,,,,,,,,,,,,,,,,,,,,,,,,,,,,,,,,,,,,,,Status,,,,,,,,,,
,"Указание на адресата некоторого сообщения (собственно адресат) или действия (~ бенефициант: ""в угоду NP-Dat""; малефициант: ""назло NP-Dat"") - Получатель информации в ситуации речи. Включает бенефицианта и малефицианта.",,585,NP/VP перед NP-Ins,NP/VP перед NP-Ins,Он умел говорить перед большой публикой.,B1,"Конструкция выражает, что [некоторый участник]Agent [произносит речь]Action, которая обращена к [большой группе людей]Addressee. Речь может также идти о творческом выступлении (песни, танцы, стихи и др.). Конструкция может также обозначать ситуацию, в которой [участник]Agent [отчитывается о своей деятельности]Action, обращаясь к другому [участнику]Addressee, как правило, более высокому по статусу, либо к [группе людей]Addressee.",,,В ближайшие дни [он]Agent пожелал [выступить]Action перед [горожанами]Addressee на главной площади и заказал соорудить огромную трибуну.,"Теперь [он]Agent знал, что перед [аудиторией]Addressee [читает стихи]Action последний раз.",1 декабря [у меня]Agent [выступление]Action перед [студентами]Addressee Римского университета.,"Власти опасались, что если пенсионные деньги раздать частным лицам, то они будут разворованы, а [отвечать]Action перед [пенсионерами]Addressee придётся [государству]Agent.",[Вы]Agent уйдёте на суд Божий и будете [отвечать]Action перед [Богом]Addressee за свои слова.,"NP, Ins, VP",Head + Modifier Construction,Prep,PP,,Manner,,Addressee,Audience,,,,,"Agent, Action, Addressee",,NA,перед,"выступать, отвечать, читать лекцию, говорить, камера, гости, аудитория, публика",,[root [nsubj NP] VP [obl [case перед] NP]]; [root [nsubj он] умел [xcomp говорить [obl [case перед] [amod большой] публикой]]],,,,Audience,,,,,,,,,,,,,,,,,,,,,Unspecified,,,,,,,,,,,,,,,,,,,,,,,,,,,
,DISTRIBUTIVE constructions with multiple objects in singular,,586,VP (NP-Dat.Pl) по NP-Dat/по NumCrd-Acc NP-Gen,VP (NP-Dat.Plur) по NP-Dat / по Num-Acc NP-Gen,Я дал всем по яблоку и по две конфеты.,B2,"Конструкция указывает на ситуацию [распределения]Action [объектов]Theme по нескольким [адресатам]Addressee. При этом говорящий уточняет, сколько [объектов]Theme получает каждый из [адресатов]Addressee. Это [количество]Quantity одинаково для всех из адресатов.",,,"Сядем на вокзале обедать, и она требует самое дорогое и на чай [всем]Addressee [даёт]Action по [рублю]Theme.",Отец [передал]Action [сыновьям]Addressee в наследство по [дому]Theme.,[Школьникам]Addressee [вручили]Action по [грамоте]Theme за участие в праздничном концерте.,[Участницы конкурса красоты]Addressee [получили]Action по [номерку.]Theme,Воспитатели [выдали]Action [детям]Addressee по [два]Quantity [полотенца]Theme ― маленькое и большое.,"VP, NP, Dat, Pl, NumCrd, Acc, Gen",Head + Modifier Construction,Adverbial Modifier,Prep,Prep,Actionality,Distributive,,,,,,,"Action, Theme, Addressee, Quantity",,NA,по,,,[root [nsubj NP-Nom] VP [obl [case по] NP-Dat]]; [root [nsubj я] дал [obl всем] [obl [case по] яблоку]],Distributive,,,,,,,,,,,,,,,,,,,,,,,,,,,,,,,,,,,,,,,,,,,,,,,,,,,
,DISTRIBUTIVE constructions with multiple objects in singular,,587,VP по NP-Dat.Pl,VP по NP-Dat.Plur,Они любили часто ездить по знакомым.,B2,"Конструкция обозначает, что участник, перемещаясь, поочёдно [посещает]Action несколько [мест]Location, которые имеют одинаковые функции или относятся к одному типу.",,,"У неё доставало сил вести этот большой дом, на всех готовить, обстирывать, шить и [ходить]Action по [магазинам]Location.",Священники [ходили]Action по [домам]Location и оповещали население.,"Он не так любил [ездить]Action по [гостям]Location, как другой мой дядя.","Самое странное началось много позже, когда я [ходила]Action с романом по [издательствам]Location.","Родственники беспокоились, [возили]Action бедную старушку по [врачам]Location.","VP, NP, Dat, Pl",Head + Modifier Construction,Adverbial Modifier,Prep,Prep,Actionality,Distributive,,,,,,,"Action, Location",,Colloquial,по,"ездить, возить, ходить, магазины, гости, знакомые, друзья, родственники",,[root [nsubj NP-Nom] VP [obl [case по] [NP-Dat]]; [root [nsubj они] любили [xcomp [advmod часто] ездить [obl [case по] знакомым]]],Distributive,,,,,,,,,,,,,,,,,,,,,,,,,,,,,,,,,,,,,,,,,,,,,,,,,,,
,,,588,VP под шумок,VP под шумок,Маша ушла под шумок.,,,,,,,,,,,Head + Modifier Construction,Adverbial Modifier,PP,Prep; Noun,Manner,,,,,,,,,,Colloquial,,,,,,,,,,,,,,,,,,,,,,,,,,,,,Unspecified,,,,,,,,,,,,,,,,,,,,,,,,,,,
,,,589,"XP/Cl точно так же, как (и) XP/Cl","XP/Cl точно так же, как (и) XP/Cl","Мама готовит пирог точно так же, как и бабушка.",,,,,,,,,,,Matrix + Subordinate Clause Construction,Matrix Predicate,Conj; Adv,,Comparison,Equality,,,,,,,,,NA,,,,,,,,,,,,,,,,,Equality,,,,,,,,,,,,,,,,,,,,,,,,,,,,,,,,,,,,,,,
,,,590,NP-Nom VP NP-Acc NP-Ins,NP-Nom VP NP-Acc NP-Ins,Он поставил своего ученика подсобником.,,,,,,,,,,,Clause,Verb pattern,NA,,Salient property,Status,,,,,,,,,NA,,,,,,,,,,,,,,,,,,,,,,,,,,,,,,,,,,,,,,,,,,,,,,Status,,,,,,,Unspecified,,,
,,,591,VP NP-Acc VP-Inf,VP NP-Acc VP-Inf,Он достал деньги поехать на юг.,,,,,,,,,,,Head + Modifier Construction,NA,NA,NA,Purpose,,Causation,Indirect,,,,,,,NA,,,,,,,,,,,,,,Indirect,,,,,,,,,,,,,,,,,,,,,,,,,Unspecified,,,,,,,,,,,,,,,,,
,,,592,NP-Nom VP NP-Dat,NP-Nom VP NP-Dat,Он смеялся чужой беде.,,,,,,,,,,,Clause,Verb pattern,,,Attitude,Emotional attitude,,,,,,,,,NA,,,,,,,,,,,Emotional attitude,,,,,,,,,,,,,,,,,,,,,,,,,,,,,,,,,,,,,,,,,,,,,
,,,593,VP NP-Ins.Pl NP-Acc,VP NP-Ins.Plur NP-Acc,Она скупала мешками картошку в магазине.,,,,,,,,,,,Head + Modifier Construction,NA,NA,NA,Degree of intensity,Booster,,,,,,,,,NA,,,,,,,,,,,,,,,,,,,,,,Booster,,,,,,,,,,,,,,,,,,,,,,,,,,,,,,,,,,
,,,594,NP-Nom VP-Inf Cop не дурак,NP-Nom VP-Inf Cop не дурак,Он выпить не дурак.,,,,,,,,,,,Copula Construction,Praedicаtive Expression,,,Assessment,Positive; Negative,,,,,,,,,Colloquial,,,,,,,,,,"Positive, Negative",,,,,,,,,,,,,,,,,,,,,,,,,,,,,,,,,,,,,,,,,,,,,,
,,,595,"VP-Inf(-то) ~VP, а/но Cl","VP-Inf(-то) VP, а/но Cl","Спросить спрошу, но он может не знать.",,,,,,,,,,,Biclausal Construction,Verb pattern,,,Concession,,,,,,,,,,Colloquial,,,,,,,,,,,,,,,,,,,Imitative agreement,,,,,,,,,,,,,,,,,,,,,,,,,,,,,,,,,,,,,
,,,596,"VP-Pst было, но Cl","VP-Past было, но Cl","Я пошел было на работу, но передумал.",,,,,,,,,,,Clause,Biclausal,,,Result,Antiresultative,,,,,,,,Assertive,Colloquial,,,,,,,,,,,,,,,,,,,,,,,,,,,,,,,,,,,,,,,,,,,Antiresultative,,,,,,,,,,,,,
,Семья конструкций с континуативной семантикой и с редупликацией (Continuative constructions with a reduplicative pattern),,597,VP-~VP а не Cl,VP-VP а не Cl,"Я его просил-просил, а он не соглашался.",B2,"Конструкция обозначает, что [некоторый участник]Agent долго и усиленно [делал что-либо]Activity, но в итоге не достиг [желаемого результата]Result. Длительность и интенсивность действия передается с помощью повторения глагола.",,,"[Мы]Agent его [ждали-ждали]Activity целый день, а он не [приехал]Result.","[Выбираю-выбираю кроватку]Activity для ребенка, а ничего подходящего не могу [найти]Result.","Всё [читаем-читаем эту книгу]Activity, а [найти нужный абзац не можем]Result.","Начали эти шестьдесят тыщ тратить. [Тратили, тратили]Activity, а они не [тратятся]Result.","Товарищ полковник, [я]Agent всё [стучу, стучу]Activity, а вы не [открываете]Result.","VP, Cl",Clause,Verb pattern,Reduplication; Negation,Conj; Negation marker,Phase of action,Continuative,Degree of intensity,Booster,,,,,"Activity, Agent, Result",Assertive,Colloquial,"а, не","просить, делать, говорить",См. также конструкцию VP-Pst-~VP-Pst и наконец(-то) VP-Pst (Он шёл-шёл и увидел красивый дом).,"[root [nsubj NP-Nom] VP-VP [conj [cc а] [advmod не] Cl]]; [root [nsubj я] [obj его] просил-просил, [conj [cc а] [nsubj он] [advmod не] соглашается]]",,,,,,,,,,,,,,,,,,Booster,,,,,,,,,,,,,Continuative,,,,,,,,,,,,,,,,,,,,,
